{
  "schema_version": "v0",
  "report_id": "pcs-bench-report-fa5f501fb8de",
  "benchmark_suite_id": "pf-admission-v0",
  "runs": [],
  "metrics": [
    "scientific_memory_interpretability_score"
  ],
  "metric_summaries": [
    {
      "name": "scientific_memory_interpretability_score",
      "applicability": "measured",
      "score": 1.0,
      "reason": "explain_quality:bundle-admission"
    }
  ],
  "summary": {
    "total_cases": 0,
    "passed_cases": 0,
    "failed_cases": 0,
    "expected_failures_detected": 0,
    "unexpected_passes": 0,
    "unexpected_failures": 0,
    "failure_localization_accuracy": 0.0,
    "repair_hint_accuracy": 0.0,
    "formal_check_coverage": 0.0,
    "registry_coverage": 0.0,
    "scientific_memory_render_coverage": 1.0,
    "execution_mode": "simulate",
    "evidence_grade": "developer",
    "live_cases": 0,
    "simulated_cases": 1,
    "hybrid_fallback_cases": 0,
    "scientific_memory_interpretability_score": 1.0
  },
  "coverage": {
    "explain_quality": {
      "schema_version": "v0",
      "report_id": "pf-admission-explain-v0",
      "suite_id": "pf-admission-v0",
      "case_id": "bundle-admission",
      "producer_id": "provability-fabric",
      "workflow_id": "provability_fabric.admission_v0",
      "required_sections": [
        "provenance",
        "hashes",
        "handoffs",
        "verification",
        "formal_checks",
        "limitations",
        "lineage",
        "repair_hints"
      ],
      "sections": {
        "provenance": {
          "present": true,
          "score": 1.0
        },
        "hashes": {
          "present": true,
          "score": 1.0
        },
        "handoffs": {
          "present": true,
          "score": 1.0
        },
        "verification": {
          "present": true,
          "score": 1.0
        },
        "formal_checks": {
          "present": true,
          "score": 1.0
        },
        "limitations": {
          "present": true,
          "score": 1.0
        },
        "lineage": {
          "present": true,
          "score": 1.0
        },
        "repair_hints": {
          "present": true,
          "score": 1.0
        }
      },
      "sections_present_count": 8,
      "sections_required_count": 8,
      "quality_score": 1.0,
      "gaps": [],
      "source_repo": "https://github.com/SentinelOps-CI/provability-fabric",
      "source_commit": "17e414501b3e1c58e8fbde1fe89a828440a945d9",
      "signature_or_digest": "sha256:26bc5dd43693839e2f7403de8226c262e94f28d54f6da1cef7dc457d3a2de826"
    },
    "profile_coverage": {
      "schema_version": "v0",
      "coverage_id": "pf-profile-coverage-v0",
      "workflow_profile_id": "provability_fabric.admission_v0",
      "producer_id": "provability-fabric",
      "suite_id": "pf-admission-v0",
      "artifact_types_required": [
        "VerificationResult.v0",
        "SignedScienceClaimBundle.v0"
      ],
      "artifact_types_covered": [
        "VerificationResult.v0",
        "SignedScienceClaimBundle.v0"
      ],
      "semantic_checks_required": [
        "signed_input_hash_matches_verified_input"
      ],
      "semantic_checks_covered": [
        "signed_input_hash_matches_verified_input"
      ],
      "handoff_steps_required": [
        "bundle_to_verifier"
      ],
      "handoff_steps_covered": [
        "bundle_to_verifier"
      ],
      "numerator": 4.0,
      "denominator": 4.0,
      "coverage_ratio": 1.0,
      "details": {},
      "source_repo": "https://github.com/SentinelOps-CI/provability-fabric",
      "source_commit": "17e414501b3e1c58e8fbde1fe89a828440a945d9",
      "signature_or_digest": "sha256:bf28e9943e1cdfd02a8d68d64279feea1f7abeccff41c87f4086a1034ceac8e1"
    }
  },
  "failures": [],
  "source_repo": "https://github.com/fraware/pcs-bench",
  "source_commit": "2ee816754ef846df47a4eb1805d1cd0e3ae6eea8",
  "signature_or_digest": "sha256:f15391a39f7d186c2de174e9edcc70b34c780a438ddfe8f6a6920e668e17fe50",
  "producer_id": "pcs-bench"
}