{
  "schema_version": "v0",
  "report_id": "pcs-bench-report-8f94afa95746",
  "benchmark_suite_id": "certifyedge-certificate-v0",
  "runs": [],
  "metrics": [
    "certificate_completeness_score"
  ],
  "metric_summaries": [
    {
      "name": "certificate_completeness_score",
      "applicability": "measured",
      "score": 1.0
    }
  ],
  "summary": {
    "total_cases": 0,
    "passed_cases": 0,
    "failed_cases": 0,
    "expected_failures_detected": 0,
    "unexpected_passes": 0,
    "unexpected_failures": 0,
    "failure_localization_accuracy": 0.0,
    "repair_hint_accuracy": 0.0,
    "formal_check_coverage": 0.0,
    "registry_coverage": 0.0,
    "scientific_memory_render_coverage": 0.0,
    "execution_mode": "simulate",
    "evidence_grade": "developer",
    "live_cases": 0,
    "simulated_cases": 1,
    "hybrid_fallback_cases": 0,
    "certificate_completeness_score": 1.0
  },
  "coverage": {
    "certificate_completeness": {
      "schema_version": "v0",
      "coverage_id": "certifyedge-cert-bench-v0",
      "metric": "certificate_completeness",
      "metric_id": "certificate_completeness_score",
      "numerator": 4.0,
      "denominator": 4.0,
      "coverage_ratio": 1.0,
      "details": {
        "producer_id": "certifyedge",
        "certificate_id": "cert-labtrust-qc-v0",
        "violations": []
      },
      "source_repo": "https://github.com/fraware/CertifyEdge",
      "source_commit": "17e414501b3e1c58e8fbde1fe89a828440a945d9",
      "signature_or_digest": "sha256:41a447e3d126819a85e77dc2ddbc3e67a2d9dfe4c1e86cf0481022ef6e7c06e5"
    }
  },
  "failures": [],
  "source_repo": "https://github.com/fraware/pcs-bench",
  "source_commit": "2ee816754ef846df47a4eb1805d1cd0e3ae6eea8",
  "signature_or_digest": "sha256:c82974375da92456a3e008eb067f357236a23624bb68f8c2e1eb9c1ded1009c7",
  "producer_id": "pcs-bench"
}